<?xml version="1.0" encoding="UTF-8"?>

<prodotti xmlns:xsi="http://www.w3.org/2001/XMLSchema-instance" 
    xsi:noNamespaceSchemaLocation="prodotti.xsd">
    
 <prodotto id="1">
    <nome>Chitarra Elettrica Fender Stratocaster</nome>
    <categoria>Strumenti a corda</categoria>
    <descrizione>Chitarra elettrica a sei corde, corpo in ontano, manico in acero.</descrizione>
    <prezzo>999.99</prezzo>
    <bonus>100.00</bonus>
    <data_inserimento>2025-05-05</data_inserimento>
    <immagine>../img/fender_stratocaster.jpg</immagine>
</prodotto>

 <prodotto id="2">
    <nome>Album - The Dark Side of the Moon</nome>
    <categoria>dischi</categoria>
    <descrizione>Iconico album dei Pink Floyd, versione rimasterizzata.</descrizione>
    <prezzo>19.99</prezzo>
    <bonus>10.00</bonus>
    <data_inserimento>2025-05-05</data_inserimento>
    <immagine>../img/Dark_side_of_the_moon.jpg</immagine>
 </prodotto>

</prodotti>